{
  "repo_fingerprint": "aaa948fffcdc369e6f10956cb4c336e8cd876c78",
  "produced_by": "runtime/scripts/walk-journeys.mjs",
  "approval": {
    "granted": true,
    "statement": "User approved executing the bundled taskdesk-legacy target for Milestone 3 runtime journeys in the Claude Code session of 2026-07-07 (\"ok, lets finish it\"; \"do what is sensible\")."
  },
  "environment": {
    "declared_dependencies": [
      {
        "name": "java-17 (~/opt/jdk17)",
        "satisfied": true,
        "version": "17"
      },
      {
        "name": "maven (~/opt/maven, built the deployed WAR)",
        "satisfied": true,
        "version": "3.9"
      },
      {
        "name": "tomcat-9 (~/opt/tomcat9, javax.servlet)",
        "satisfied": true,
        "version": "9.0.120"
      },
      {
        "name": "node",
        "satisfied": true,
        "version": "24"
      },
      {
        "name": "playwright-chromium",
        "satisfied": true,
        "version": "1.61"
      }
    ],
    "app_base_url": "http://localhost:8080/taskdesk-legacy",
    "container": "tomcat-9.0.120"
  },
  "db_snapshot": {
    "source_file": "db/runtime-data/taskdesk-demo.sqlite",
    "source_sha256": "93d02f7d265f0a10a80ddc9b048476782501534cc2e01d8ef868594580521944",
    "copy_path": "runtime/db/taskdesk-demo.sqlite"
  },
  "journeys": [
    {
      "id": "journey:login-task-review",
      "name": "Login and review a task (operator1)",
      "flow_hypothesis": "claim:taskdesk-readme:login-entry plus the static route chain /login -> /tasks -> /taskDetail from struts-config forwards",
      "actor": "operator1",
      "steps": [
        {
          "index": 1,
          "action": "goto",
          "url": "/taskdesk-legacy/login.do",
          "route": "/login",
          "request_method": "GET",
          "form_fields": [],
          "response_status": 200,
          "redirect_location": null,
          "rendered_view": "/jsp/login.jsp",
          "view_evidence": "title: TaskDesk Login",
          "trace_ref": {
            "path": "runtime/traces/login-task-review/step-1.json",
            "sha256": "a4441effe18d9571743a0d3e068c42be84b9d69e0c871a4be8d3cd5451edf865"
          },
          "screenshot": {
            "path": "runtime/traces/login-task-review/step-1.png",
            "sha256": "195e48b7f26ee325c263048119dc41acead8d32fd3c1e4b5c9c463b47964da00"
          },
          "db_diff": null
        },
        {
          "index": 2,
          "action": "submit-form",
          "url": "/taskdesk-legacy/login.do",
          "route": "/login",
          "request_method": "POST",
          "form_fields": [
            "username",
            "password"
          ],
          "response_status": 302,
          "redirect_location": "/taskdesk-legacy/tasks.do",
          "rendered_view": "/jsp/taskList.jsp",
          "view_evidence": "title: Task List",
          "trace_ref": {
            "path": "runtime/traces/login-task-review/step-2.json",
            "sha256": "fb1deb5a0c398169ed2d4a1dbd5ed1982fddc8608dc5386f08f972b856b86e5b"
          },
          "screenshot": {
            "path": "runtime/traces/login-task-review/step-2.png",
            "sha256": "98fe38beab7acfd6a8a07dbdda21c6b384690981e333e6abbbff3f5fae33e228"
          },
          "db_diff": null
        },
        {
          "index": 3,
          "action": "click",
          "url": "/taskdesk-legacy/taskDetail.do?taskId=1",
          "route": "/taskDetail",
          "request_method": "GET",
          "form_fields": [],
          "response_status": 200,
          "redirect_location": null,
          "rendered_view": "/jsp/taskDetail.jsp",
          "view_evidence": "title: Task Detail",
          "trace_ref": {
            "path": "runtime/traces/login-task-review/step-3.json",
            "sha256": "2d47d9200fe64b04e546a71641414d28db9d7096da8470bcaf6a8bafc6bef768"
          },
          "screenshot": {
            "path": "runtime/traces/login-task-review/step-3.png",
            "sha256": "0354e0a5c143d4bd0779d7b885bc09fc94d888588f0d963689696fe53a9279ac"
          },
          "db_diff": null
        }
      ],
      "corroborates": [
        "sem:entrypoint:struts-action-servlet-do",
        "sem:action:login",
        "sem:view:login",
        "sem:action:tasks",
        "sem:view:taskList",
        "sem:action:taskDetail",
        "sem:view:taskDetail"
      ],
      "properties": {
        "slice": "corroboration (spec §7 Milestone 3)"
      }
    },
    {
      "id": "journey:role-denied-operator",
      "name": "Operator is denied a manager-only action",
      "flow_hypothesis": "static role check in TaskAssignAction (SecurityUtils.isManager -> findForward(\"denied\")); tests sem:rule:manager-role-checks behaviourally",
      "actor": "operator1",
      "steps": [
        {
          "index": 1,
          "action": "submit-form",
          "url": "/taskdesk-legacy/login.do",
          "route": "/login",
          "request_method": "POST",
          "form_fields": [
            "username",
            "password"
          ],
          "response_status": 302,
          "redirect_location": "/taskdesk-legacy/tasks.do",
          "rendered_view": "/jsp/taskList.jsp",
          "view_evidence": "logged in as operator1; title: Task List",
          "trace_ref": {
            "path": "runtime/traces/role-denied-operator/step-1.json",
            "sha256": "9644c85cd1acfe656cb51a20a57f121ee8fef1474f8eab38183f37003488b32d"
          },
          "screenshot": null,
          "db_diff": null
        },
        {
          "index": 2,
          "action": "goto",
          "url": "/taskdesk-legacy/taskAssign.do?taskId=1",
          "route": "/taskAssign",
          "request_method": "GET",
          "form_fields": [],
          "response_status": 200,
          "redirect_location": null,
          "rendered_view": "/jsp/accessDenied.jsp",
          "view_evidence": "title: Access denied",
          "trace_ref": {
            "path": "runtime/traces/role-denied-operator/step-2.json",
            "sha256": "d8206f9be943b8d27a37ac253cbdab4a784c732afb52471f85c962c7fdbfe674"
          },
          "screenshot": {
            "path": "runtime/traces/role-denied-operator/step-2.png",
            "sha256": "78e7d9d95b45d7ea45e057c131b9c1ea2272b45a217b2bac8844d8351384cf84"
          },
          "db_diff": null
        }
      ],
      "corroborates": [
        "sem:security:session-login",
        "sem:rule:manager-role-checks",
        "sem:view:accessDenied"
      ],
      "properties": {
        "access_control_outcome": "denied",
        "probed_route": "/taskAssign"
      }
    },
    {
      "id": "journey:role-allowed-manager",
      "name": "Manager is allowed the same manager-only action",
      "flow_hypothesis": "same route as journey:role-denied-operator, walked as a manager; the diff proves the role rule is enforced, not merely declared",
      "actor": "manager1",
      "steps": [
        {
          "index": 1,
          "action": "submit-form",
          "url": "/taskdesk-legacy/login.do",
          "route": "/login",
          "request_method": "POST",
          "form_fields": [
            "username",
            "password"
          ],
          "response_status": 302,
          "redirect_location": "/taskdesk-legacy/tasks.do",
          "rendered_view": "/jsp/taskList.jsp",
          "view_evidence": "logged in as manager1; title: Task List",
          "trace_ref": {
            "path": "runtime/traces/role-allowed-manager/step-1.json",
            "sha256": "547dc2d0721868ad20e8b161bcb42063a75134c3a4675e1210b2d8ee70496ad8"
          },
          "screenshot": null,
          "db_diff": null
        },
        {
          "index": 2,
          "action": "goto",
          "url": "/taskdesk-legacy/taskAssign.do?taskId=1",
          "route": "/taskAssign",
          "request_method": "GET",
          "form_fields": [],
          "response_status": 200,
          "redirect_location": null,
          "rendered_view": "/jsp/taskAssign.jsp",
          "view_evidence": "title: Assign Task",
          "trace_ref": {
            "path": "runtime/traces/role-allowed-manager/step-2.json",
            "sha256": "62d8c1b5fa4c70dd89e56f765f053568b0fabc10000d8727ab4cbf17f626d4bd"
          },
          "screenshot": {
            "path": "runtime/traces/role-allowed-manager/step-2.png",
            "sha256": "f27d9e764389d9ccdfafa7f45aa0c4d5ea0355d332604566800939ed65d6684f"
          },
          "db_diff": null
        }
      ],
      "corroborates": [
        "sem:security:session-login",
        "sem:rule:manager-role-checks",
        "sem:action:taskAssign",
        "sem:view:taskAssign"
      ],
      "properties": {
        "access_control_outcome": "allowed",
        "probed_route": "/taskAssign"
      }
    },
    {
      "id": "journey:login-validation",
      "name": "Empty login is rejected by required-field validation",
      "flow_hypothesis": "Struts validator required fields on loginForm (validation.xml username/password); tests sem:rule:validator-required-fields behaviourally",
      "actor": "anonymous",
      "steps": [
        {
          "index": 1,
          "action": "goto",
          "url": "/taskdesk-legacy/login.do",
          "route": "/login",
          "request_method": "GET",
          "form_fields": [],
          "response_status": 200,
          "redirect_location": null,
          "rendered_view": "/jsp/login.jsp",
          "view_evidence": "title: TaskDesk Login",
          "trace_ref": {
            "path": "runtime/traces/login-validation/step-1.json",
            "sha256": "a4441effe18d9571743a0d3e068c42be84b9d69e0c871a4be8d3cd5451edf865"
          },
          "screenshot": {
            "path": "runtime/traces/login-validation/step-1.png",
            "sha256": "195e48b7f26ee325c263048119dc41acead8d32fd3c1e4b5c9c463b47964da00"
          },
          "db_diff": null
        },
        {
          "index": 2,